{
  "$schema": "https://sethmay.github.io/open-scout-api/schema/v1/adventure.schema.json",
  "id": "race-time-webelos",
  "kind": "adventure",
  "versions": [
    {
      "valid_from": "2024",
      "valid_to": null,
      "name": "Race Time Webelos",
      "program": "cub_scouts",
      "ranks": [
        "rank:webelos"
      ],
      "category": "elective",
      "area": null,
      "url": "https://www.scouting.org/cub-scout-adventures/race-time-webelos/",
      "provenance": {
        "sources": [
          {
            "url": "https://www.scouting.org/cub-scout-adventures/race-time-webelos/",
            "accessed": "2026-09-10"
          }
        ],
        "method": "scraped",
        "verified_at": "2026-09-10",
        "confidence": 0.9,
        "notes": "Name, rank placement and category from the official rank adventure pages. The evergreen description is original prose regenerated from the adventure's own 'Snapshot' section, excluding requirement text."
      },
      "description": "Webelos build a car or boat and race it, exploring how propulsion moves a vehicle and how friction slows it down, all while practicing good sportsmanship."
    }
  ],
  "notes": null
}
