{
  "$schema": "https://sethmay.github.io/open-scout-api/schema/v1/adventure.schema.json",
  "id": "my-safety",
  "kind": "adventure",
  "versions": [
    {
      "valid_from": "2024",
      "valid_to": null,
      "name": "My Safety",
      "program": "cub_scouts",
      "ranks": [
        "rank:webelos"
      ],
      "category": "required",
      "area": "personal_safety",
      "url": "https://www.scouting.org/cub-scout-adventures/my-safety/",
      "provenance": {
        "sources": [
          {
            "url": "https://www.scouting.org/cub-scout-adventures/my-safety/",
            "accessed": "2026-09-10"
          }
        ],
        "method": "scraped",
        "verified_at": "2026-09-10",
        "confidence": 0.9,
        "notes": "Name, rank placement and category from the official rank adventure pages. The evergreen description is original prose regenerated from the adventure's own 'Snapshot' section, excluding requirement text."
      },
      "description": "Webelos strengthen personal safety skills, learning to store household hazards properly, keep home and meeting spaces safe, and prepare for likely natural events."
    }
  ],
  "notes": null
}
