{
  "$schema": "https://sethmay.github.io/open-scout-api/schema/v1/adventure.schema.json",
  "id": "paddle-onward",
  "kind": "adventure",
  "versions": [
    {
      "valid_from": "2024",
      "valid_to": null,
      "name": "Paddle Onward",
      "program": "cub_scouts",
      "ranks": [
        "rank:webelos"
      ],
      "category": "elective",
      "area": null,
      "url": "https://www.scouting.org/cub-scout-adventures/paddle-onward/",
      "provenance": {
        "sources": [
          {
            "url": "https://www.scouting.org/cub-scout-adventures/paddle-onward/",
            "accessed": "2026-09-10"
          }
        ],
        "method": "scraped",
        "verified_at": "2026-09-10",
        "confidence": 0.9,
        "notes": "Name, rank placement and category from the official rank adventure pages. The evergreen description is original prose regenerated from the adventure's own 'Snapshot' section, excluding requirement text."
      },
      "description": "Webelos Scouts choose a canoe, kayak, or stand-up paddleboard, learn water safety and paddling basics, and spend time paddling across calm water."
    }
  ],
  "notes": null
}
