{
  "$schema": "https://sethmay.github.io/open-scout-api/schema/v1/adventure.schema.json",
  "id": "bobcat-tiger",
  "kind": "adventure",
  "versions": [
    {
      "valid_from": "2024",
      "valid_to": null,
      "name": "Bobcat Tiger",
      "program": "cub_scouts",
      "ranks": [
        "rank:tiger"
      ],
      "category": "required",
      "area": "character_leadership",
      "url": "https://www.scouting.org/cub-scout-adventures/bobcat-tiger/",
      "provenance": {
        "sources": [
          {
            "url": "https://www.scouting.org/cub-scout-adventures/bobcat-tiger/",
            "accessed": "2026-09-10"
          }
        ],
        "method": "scraped",
        "verified_at": "2026-09-10",
        "confidence": 0.9,
        "notes": "Name, rank placement and category from the official rank adventure pages. The evergreen description is original prose regenerated from the adventure's own 'Snapshot' section, excluding requirement text."
      },
      "description": "Tigers take their first steps on the trail to their badge, getting to know their den and learning the core signs, promises, and traditions of Cub Scouting."
    }
  ],
  "notes": null
}
