{
  "$schema": "https://sethmay.github.io/open-scout-api/schema/v1/adventure.schema.json",
  "id": "fish-on",
  "kind": "adventure",
  "versions": [
    {
      "valid_from": "2024",
      "valid_to": null,
      "name": "Fish On",
      "program": "cub_scouts",
      "ranks": [
        "rank:tiger"
      ],
      "category": "elective",
      "area": null,
      "url": "https://www.scouting.org/cub-scout-adventures/fish-on/",
      "provenance": {
        "sources": [
          {
            "url": "https://www.scouting.org/cub-scout-adventures/fish-on/",
            "accessed": "2026-09-10"
          }
        ],
        "method": "scraped",
        "verified_at": "2026-09-10",
        "confidence": 0.9,
        "notes": "Name, rank placement and category from the official rank adventure pages. The evergreen description is original prose regenerated from the adventure's own 'Snapshot' section, excluding requirement text."
      },
      "description": "Tigers learn fishing basics with their adult partner, identify a nearby body of water, review safety rules, and cast a line on a real fishing trip."
    }
  ],
  "notes": null
}
