{
  "$schema": "https://sethmay.github.io/open-scout-api/schema/v1/adventure.schema.json",
  "id": "champions-for-nature-webelos",
  "kind": "adventure",
  "versions": [
    {
      "valid_from": "2024",
      "valid_to": null,
      "name": "Champions for Nature Webelos",
      "program": "cub_scouts",
      "ranks": [
        "rank:webelos"
      ],
      "category": "elective",
      "area": null,
      "url": "https://www.scouting.org/cub-scout-adventures/champions-for-nature-webelos/",
      "provenance": {
        "sources": [
          {
            "url": "https://www.scouting.org/cub-scout-adventures/champions-for-nature-webelos/",
            "accessed": "2026-09-10"
          }
        ],
        "method": "scraped",
        "verified_at": "2026-09-10",
        "confidence": 0.9,
        "notes": "Name, rank placement and category from the official rank adventure pages. The evergreen description is original prose regenerated from the adventure's own 'Snapshot' section, excluding requirement text."
      },
      "description": "Webelos study the wildlife that shares our planet, learn how people protect threatened and endangered animals, and put that knowledge to work on a conservation project."
    }
  ],
  "notes": null
}
