{
  "$schema": "https://sethmay.github.io/open-scout-api/schema/v1/adventure.schema.json",
  "id": "pick-my-path-lion",
  "kind": "adventure",
  "versions": [
    {
      "valid_from": "2018-09-01",
      "valid_to": "2024",
      "name": "Pick my Path",
      "program": "cub_scouts",
      "ranks": [
        "rank:lion"
      ],
      "category": "elective",
      "area": null,
      "url": null,
      "provenance": {
        "sources": [
          {
            "url": "http://usscouts.org/advance/cubscout/lion-elective.asp",
            "accessed": "2026-07-27"
          }
        ],
        "method": "scraped",
        "verified_at": "2026-07-27",
        "confidence": 0.8,
        "notes": "Pre-2024 Cub program, via the U.S. Scouting Service Project archive (usscouts.org), which is unaffiliated with Scouting America."
      }
    },
    {
      "valid_from": "2024",
      "valid_to": null,
      "name": "Pick My Path",
      "program": "cub_scouts",
      "ranks": [
        "rank:lion"
      ],
      "category": "elective",
      "area": null,
      "url": "https://www.scouting.org/cub-scout-adventures/pick-my-path-lion/",
      "provenance": {
        "sources": [
          {
            "url": "https://www.scouting.org/cub-scout-adventures/pick-my-path-lion/",
            "accessed": "2026-09-10"
          }
        ],
        "method": "scraped",
        "verified_at": "2026-09-10",
        "confidence": 0.9,
        "notes": "Name, rank placement and category from the official rank adventure pages. The evergreen description is original prose regenerated from the adventure's own 'Snapshot' section, excluding requirement text."
      },
      "description": "A Lion learns through game play that choices carry consequences, performs a Good Turn for another person, and learns the basic rules of a new game and plays it."
    }
  ],
  "notes": null
}
