{
  "$schema": "https://sethmay.github.io/open-scout-api/schema/v1/adventure.schema.json",
  "id": "catch-the-big-one",
  "kind": "adventure",
  "versions": [
    {
      "valid_from": "2024",
      "valid_to": null,
      "name": "Catch the Big One",
      "program": "cub_scouts",
      "ranks": [
        "rank:webelos"
      ],
      "category": "elective",
      "area": null,
      "url": "https://www.scouting.org/cub-scout-adventures/catch-the-big-one/",
      "provenance": {
        "sources": [
          {
            "url": "https://www.scouting.org/cub-scout-adventures/catch-the-big-one/",
            "accessed": "2026-09-10"
          }
        ],
        "method": "scraped",
        "verified_at": "2026-09-10",
        "confidence": 0.9,
        "notes": "Name, rank placement and category from the official rank adventure pages. The evergreen description is original prose regenerated from the adventure's own 'Snapshot' section, excluding requirement text."
      },
      "description": "A Webelos Scout plans a fishing trip, describes where the fish live, gathers the right gear, ties a hook knot, picks a suitable rod and tackle, and spends time fishing responsibly."
    }
  ],
  "notes": null
}
