{
  "$schema": "https://sethmay.github.io/open-scout-api/schema/v1/adventure.schema.json",
  "id": "robotics",
  "kind": "adventure",
  "versions": [
    {
      "valid_from": "2018-09-01",
      "valid_to": "2022-06-01",
      "name": "Robotics",
      "program": "cub_scouts",
      "ranks": [
        "rank:bear"
      ],
      "category": "elective",
      "area": null,
      "url": null,
      "provenance": {
        "sources": [
          {
            "url": "http://usscouts.org/advance/cubscout/old/bear-elective-2018.asp",
            "accessed": "2026-07-27"
          }
        ],
        "method": "scraped",
        "verified_at": "2026-07-27",
        "confidence": 0.8,
        "notes": "Pre-2024 Cub program, via the U.S. Scouting Service Project archive (usscouts.org), which is unaffiliated with Scouting America."
      }
    }
  ],
  "notes": null
}
