{
  "$schema": "https://sethmay.github.io/open-scout-api/schema/v1/adventure.schema.json",
  "id": "tigers-in-the-wild",
  "kind": "adventure",
  "versions": [
    {
      "valid_from": "2018-09-01",
      "valid_to": "2024",
      "name": "Tigers in the Wild",
      "program": "cub_scouts",
      "ranks": [
        "rank:tiger"
      ],
      "category": "required",
      "area": null,
      "url": null,
      "provenance": {
        "sources": [
          {
            "url": "http://usscouts.org/advance/cubscout/tiger-core.asp",
            "accessed": "2026-07-27"
          }
        ],
        "method": "scraped",
        "verified_at": "2026-07-27",
        "confidence": 0.8,
        "notes": "Pre-2024 Cub program, via the U.S. Scouting Service Project archive (usscouts.org), which is unaffiliated with Scouting America."
      }
    },
    {
      "valid_from": "2024",
      "valid_to": null,
      "name": "Tigers in the Wild",
      "program": "cub_scouts",
      "ranks": [
        "rank:tiger"
      ],
      "category": "required",
      "area": "outdoors",
      "url": "https://www.scouting.org/cub-scout-adventures/tigers-in-the-wild/",
      "provenance": {
        "sources": [
          {
            "url": "https://www.scouting.org/cub-scout-adventures/tigers-in-the-wild/",
            "accessed": "2026-09-10"
          }
        ],
        "method": "scraped",
        "verified_at": "2026-09-10",
        "confidence": 0.9,
        "notes": "Name, rank placement and category from the official rank adventure pages. The evergreen description is original prose regenerated from the adventure's own 'Snapshot' section, excluding requirement text."
      },
      "description": "Tigers and their adult partners take a walk in the outdoors, learning the Outdoor Code and the Six Essentials. They spot natural and made things and tell wild animals from domesticated ones."
    }
  ],
  "notes": null
}
