{
  "$schema": "https://sethmay.github.io/open-scout-api/schema/v1/adventure.schema.json",
  "id": "into-the-woods",
  "kind": "adventure",
  "versions": [
    {
      "valid_from": "2018-09-01",
      "valid_to": "2024",
      "name": "Into the Woods",
      "program": "cub_scouts",
      "ranks": [
        "rank:webelos",
        "rank:arrow-of-light"
      ],
      "category": "elective",
      "area": null,
      "url": null,
      "provenance": {
        "sources": [
          {
            "url": "http://usscouts.org/advance/cubscout/old/webelos-aol-elective-2018.asp",
            "accessed": "2026-07-27"
          }
        ],
        "method": "scraped",
        "verified_at": "2026-07-27",
        "confidence": 0.8,
        "notes": "Pre-2024 Cub program, via the U.S. Scouting Service Project archive (usscouts.org), which is unaffiliated with Scouting America."
      }
    },
    {
      "valid_from": "2024",
      "valid_to": null,
      "name": "Into the Woods",
      "program": "cub_scouts",
      "ranks": [
        "rank:arrow-of-light"
      ],
      "category": "elective",
      "area": null,
      "url": "https://www.scouting.org/cub-scout-adventures/into-the-woods/",
      "provenance": {
        "sources": [
          {
            "url": "https://www.scouting.org/cub-scout-adventures/into-the-woods/",
            "accessed": "2026-09-10"
          }
        ],
        "method": "scraped",
        "verified_at": "2026-09-10",
        "confidence": 0.9,
        "notes": "Name, rank placement and category from the official rank adventure pages. The evergreen description is original prose regenerated from the adventure's own 'Snapshot' section, excluding requirement text."
      },
      "description": "Arrow of Light Scouts head outdoors to inventory trees and plants, then study one tree closely to learn what it offers people, wildlife, and the planet."
    }
  ],
  "notes": null
}
